{
  "$schema": "https://json-schema.org/draft/2020-12/schema",
  "type": "object",
  "required": [
    "workflow_id",
    "template",
    "version",
    "steps",
    "completion_criteria"
  ],
  "properties": {
    "workflow_id": {
      "type": "string"
    },
    "template": {
      "type": "string"
    },
    "version": {
      "type": "string"
    },
    "steps": {
      "type": "array",
      "items": {
        "type": "object",
        "required": [
          "id",
          "capability",
          "depends_on",
          "inputs",
          "outputs",
          "success_criteria",
          "failure_codes",
          "evidence_required",
          "on_success",
          "on_failure"
        ],
        "properties": {
          "id": {
            "type": "string"
          },
          "capability": {
            "type": "string"
          },
          "depends_on": {
            "type": "array",
            "items": {
              "type": "string"
            }
          },
          "inputs": {
            "type": "array",
            "items": {
              "type": "string"
            }
          },
          "outputs": {
            "type": "array",
            "items": {
              "type": "string"
            }
          },
          "success_criteria": {
            "type": "array",
            "items": {
              "type": "string"
            }
          },
          "failure_codes": {
            "type": "array",
            "items": {
              "type": "string"
            }
          },
          "evidence_required": {
            "type": "array",
            "items": {
              "type": "string"
            }
          },
          "on_success": {
            "type": "string"
          },
          "on_failure": {
            "type": "string"
          }
        }
      }
    },
    "completion_criteria": {
      "type": "array",
      "items": {
        "type": "string"
      }
    }
  }
}